### ISSUE TITLE
Possible configuration issue with zeek-agent / zeek-agent-framework example? 

### ISSUE THREAD

**Issue by set-element** [zeek/zeek-agent#1]
Greetings!  I am having a problem getting a completely vanilla version of zeek-agent to connect to zeek running the zeek-agent-framework. More specifically, from the TCP perspective everything is ok, and tcpdump repeatedly shows completed handshakes, a couple pushes, then a FIN so I suspect that there is a broker configuration issue in the examples provided.  When zeek-agent connects to zeek, there is no indication in the logs that anything has happened in the way of application layer communication.

Thank you for your time and attention - this is a really interesting development for zeek's evolution and we are really excited about it.

cheers,
scott

Details follow:
Background - all software is running on a new dedicated host, selinux has been disabled, and all code running as root. Zeek runs without errors or problems with a default config.

system: CentOS Linux release 7.6.1810 (Core)
zeek version 3.1.0-dev.361-debug
zeek-agent-framework 0.4-10
Zeek Agent v1.0.1
auditd configured as in the example for the zeek-agent config guide
audisp configured and running

The dataflow looks like

auditd -> AF_UNIX -> zeek-agent -> broker ->zeek-agent-framework -> zeek

I know that zeek-agent is seeing the auditd data since it is logging messages about having to drop it:

```
2020-01-10 04:28:29 Error: Reconnecting has failed. Retrying again later...
2020-01-10 04:28:29 Warning: socket_events: Dropping 1 rows (max row count is set to 5
2020-01-10 04:28:29 Warning: process_events: Dropping 2 rows (max row count is set to 5
2020-01-10 04:28:31 Warning: process_events: Dropping 1 rows (max row count is set to 5
2020-01-10 04:28:35 Error: Reconnecting has failed. Retrying again later...
```
(in this case I adjusted the max row count down to 5 to make things a bit more noisy)

As mentioned, the network connection between zeek-agent and zeek is looking good:

```
04:31:04.768012 IP 127.0.0.1.33740 > 127.0.0.1.9999: Flags [S], seq 3110763575, win 43690, options [mss 65495,sackOK,TS val 1447836 ecr 0,nop,wscale 7], length 0
04:31:04.768035 IP 127.0.0.1.9999 > 127.0.0.1.33740: Flags [S.], seq 1014240663, ack 3110763576, win 43690, options [mss 65495,sackOK,TS val 1447836 ecr 1447836,nop,wscale 7], length 0
04:31:04.768052 IP 127.0.0.1.33740 > 127.0.0.1.9999: Flags [.], ack 1, win 342, options [nop,nop,TS val 1447836 ecr 1447836], length 0
04:31:04.785462 IP 127.0.0.1.33740 > 127.0.0.1.9999: Flags [P.], seq 1:299, ack 1, win 342, options [nop,nop,TS val 1447854 ecr 1447836], length 298
04:31:04.785482 IP 127.0.0.1.9999 > 127.0.0.1.33740: Flags [.], ack 299, win 350, options [nop,nop,TS val 1447854 ecr 1447854], length 0
04:31:04.797382 IP 127.0.0.1.9999 > 127.0.0.1.33740: Flags [P.], seq 1:186, ack 299, win 350, options [nop,nop,TS val 1447866 ecr 1447854], length 185
04:31:04.797398 IP 127.0.0.1.33740 > 127.0.0.1.9999: Flags [.], ack 186, win 350, options [nop,nop,TS val 1447866 ecr 1447866], length 0
04:31:04.821803 IP 127.0.0.1.33740 > 127.0.0.1.9999: Flags [P.], seq 299:481, ack 186, win 350, options [nop,nop,TS val 1447890 ecr 1447866], length 182
04:31:04.826501 IP 127.0.0.1.9999 > 127.0.0.1.33740: Flags [P.], seq 186:436, ack 481, win 359, options [nop,nop,TS val 1447895 ecr 1447890], length 250
04:31:04.826562 IP 127.0.0.1.9999 > 127.0.0.1.33740: Flags [P.], seq 436:569, ack 481, win 359, options [nop,nop,TS val 1447895 ecr 1447890], length 133
04:31:04.827067 IP 127.0.0.1.33740 > 127.0.0.1.9999: Flags [.], ack 569, win 367, options [nop,nop,TS val 1447895 ecr 1447895], length 0
04:31:04.827144 IP 127.0.0.1.33740 > 127.0.0.1.9999: Flags [F.], seq 481, ack 569, win 367, options [nop,nop,TS val 1447895 ecr 1447895], length 0
04:31:04.828169 IP 127.0.0.1.9999 > 127.0.0.1.33740: Flags [F.], seq 569, ack 482, win 359, options [nop,nop,TS val 1447896 ecr 1447895], length 0
04:31:04.828181 IP 127.0.0.1.33740 > 127.0.0.1.9999: Flags [.], ack 570, win 367, options [nop,nop,TS val 1447896 ecr 1447896], length 0
```

Finally, the logs produced by zeek (started by "bin/zeek -B broker  zeek-agent") look like:

```
[root@centos-s-1vcpu-2gb-nyc1-01 tmp]# cat debug.log
         0.000000/1578630658.973670 [broker] Initializing
1578630659.016740/1578630659.053613 [broker] Subscribing to topic prefix /zeek/zeek-agent/zeek/BroMaster
1578630659.016740/1578630659.058005 [broker] Listening on 0.0.0.0:9999
1578630659.016740/1578630659.058067 [broker] Subscribing to topic prefix /zeek/zeek-agent/host_announce
1578630659.016740/1578630659.059598 [broker] Subscribing to topic prefix /zeek/zeek-agent/zeek_announce
1578630659.016740/1578630659.060547 [broker] Subscribing to topic prefix /zeek/zeek-agent/zeek/924A36C480EC73E6E612AD663776410DC79CE400#4133
1578630659.016740/1578630659.061843 [broker] Subscribing to topic prefix /zeek/zeek-agent/zeek/BroMaster
[root@centos-s-1vcpu-2gb-nyc1-01 tmp]# cat zeek-agent-hosts.log
#separator \x09
#set_separator    ,
#empty_field    (empty)
#unset_field    -
#path    zeek-agent-hosts
#open    2020-01-10-04-30-59
#fields    ts    source    peer    level    message
#types    time    string    string    string    string
1578630659.016740    host    /zeek/zeek-agent/hosts    debug    Subscribing to event zeek_agent::table_logger() for query 'SELECT time, severity, message FROM zeek_logger'
[root@centos-s-1vcpu-2gb-nyc1-01 tmp]# cat zeek-agent.log
#separator \x09
#set_separator    ,
#empty_field    (empty)
#unset_field    -
#path    zeek-agent
#open    2020-01-10-04-30-59
#fields    ts    source    peer    level    message
#types    time    string    string    string    string
1578630659.016740    local    BroMaster    info    Subscribing to bro announce topic /zeek/zeek-agent/zeek_announce
1578630659.016740    local    BroMaster    info    Subscribing to bro individual topic /zeek/zeek-agent/zeek/924A36C480EC73E6E612AD663776410DC79CE400#4133
1578630659.016740    bro    /zeek/zeek-agent/zeeks    debug    Forwarding event zeek_agent::bro_subscribe() for query 'SELECT time, severity, message FROM zeek_logger'
[root@centos-s-1vcpu-2gb-nyc1-01 tmp]#
```

/etc/zeek-agent/config.json looks like:

```
{
  "server_address": "127.0.0.1",
  "server_port": 9999,

  "log_folder": "/var/log/zeek",
  "max_queued_row_count": 5,
  "group_list": []
}
```

max_queued_row_count has been changed from 5000 to 5 to exercise the problem a little more agressively. The settings in framework_commons.zeek are untouched.

**Comment by rsmmr** [comment]
I think there is a problem with the network connection. It's supposed to be persistent connection, so established once and then stay up. And the agent log says "Error: Reconnecting has failed. Retrying again later...", that's where the multiple retries are coming from. 

What's the agent log in `/var/log/zeek' saying? Is there a broker.log on the Zeek side? 

For comparision, when running zeek zeek-agent zeek-agent/tables` my zeek-agent log says:

```
2020-01-10 09:05:03 Information: Successfully connected to 127.0.0.1:9999
2020-01-10 09:05:03 Information: Subscribed to: /zeek/zeek-agent/hosts
2020-01-10 09:05:03 Information: Subscribed to: /zeek/zeek-agent/host/joker02.corelight
2020-01-10 09:05:04 Information: A new query has been scheduled: SELECT time, severity, message FROM zeek_logger
2020-01-10 09:05:04 Information: A new query has been scheduled: SELECT pid, path, cmdline, cwd, uid, gid, time, parent FROM process_events
2020-01-10 09:05:04 Information: A new query has been scheduled: SELECT action, pid, fd, path, family, local_address, remote_address, local_port, remote_port, time, success FROM socket_events WHERE family=2
```

**Comment by rsmmr** [comment]
No immediate idea, let's see if some Broker/CAF debug out helps. Try applying the patch below and then run the agent with `BROKER_DEBUG_LEVEL=debug ./zeek-agent`, that should then generate a log in the current directory showing what's going over the connection.

```
diff --git a/libraries/broker/generated/caf/detail/build_config.hpp b/libraries/broker/generated/caf/detail/build_config.hpp
index f9ed0c7..0767fba 100644
--- a/libraries/broker/generated/caf/detail/build_config.hpp
+++ b/libraries/broker/generated/caf/detail/build_config.hpp
@@ -21,7 +21,7 @@

 // this header is auto-generated by CMake

-#define CAF_LOG_LEVEL -1
+#define CAF_LOG_LEVEL 2

 /* #undef CAF_NO_MEM_MANAGEMENT */
```

**Comment by set-element** [comment]
Thanks for the quick response Robin!  I made the changes and a sample of the logs generated are below.  This is the contents of the first file generated:

```
1 caf DEBUG actor0 140704110851840 caf.logger log_first_line logger.cpp:614 level = trace, node = 924A36C480EC73E6E612AD663776410DC79CE407#12479, component_filter = ""
0 caf.flow DEBUG actor0 140704204359488 caf.scheduled_actor enqueue scheduled_actor.cpp:157 SEND ; TO = 7@924A36C480EC73E6E612AD663776410DC79CE407#12479 ; FROM = 0@invalid-node ; STAGES = [] ; C
ONTENT = ('add', 'status', 10@924A36C480EC73E6E612AD663776410DC79CE407#12479)
0 caf.flow DEBUG actor0 140704204359488 caf.scheduled_actor enqueue scheduled_actor.cpp:186 ACCEPT ; UNBLOCKED = false
0 caf.flow DEBUG actor0 140704204359488 caf.scheduled_actor enqueue scheduled_actor.cpp:157 SEND ; TO = 7@924A36C480EC73E6E612AD663776410DC79CE407#12479 ; FROM = 0@invalid-node ; STAGES = [] ; C
ONTENT = ('peer', 127.0.0.1:9999)
0 caf.flow DEBUG actor0 140704204359488 caf.scheduled_actor enqueue scheduled_actor.cpp:186 ACCEPT ; UNBLOCKED = false
1 caf.flow DEBUG actor7 140704152815360 caf.scheduled_actor consume scheduled_actor.cpp:629 RECEIVE ; FROM = 0@invalid-node ; STAGES = [] ; CONTENT = ('add', 'status', 10@924A36C480EC73E6E612AD6
63776410DC79CE407#12479)
1 caf.flow DEBUG actor7 140704152815360 caf.scheduled_actor consume scheduled_actor.cpp:629 RECEIVE ; FROM = 0@invalid-node ; STAGES = [] ; CONTENT = ('peer', 127.0.0.1:9999)
1 caf.flow DEBUG actor7 140704152815360 caf.scheduled_actor enqueue scheduled_actor.cpp:157 SEND ; TO = 6@924A36C480EC73E6E612AD663776410DC79CE407#12479 ; FROM = 7@924A36C480EC73E6E612AD66377641
0DC79CE407#12479 ; STAGES = [] ; CONTENT = ('connect', "127.0.0.1", 9999)
1 caf.flow DEBUG actor7 140704152815360 caf.scheduled_actor enqueue scheduled_actor.cpp:186 ACCEPT ; UNBLOCKED = false
1 caf.flow DEBUG actor6 140704119244544 caf.scheduled_actor consume scheduled_actor.cpp:629 RECEIVE ; FROM = 7@924A36C480EC73E6E612AD663776410DC79CE407#12479 ; STAGES = [] ; CONTENT = ('connect'
, "127.0.0.1", 9999)
1 caf.flow DEBUG actor6 140704119244544 caf.scheduled_actor enqueue scheduled_actor.cpp:157 SEND ; TO = 7@924A36C480EC73E6E612AD663776410DC79CE407#12479 ; FROM = 6@924A36C480EC73E6E612AD66377641
0DC79CE407#12479 ; STAGES = [] ; CONTENT = (error(17, 'system', ("ip_connect failed", "127.0.0.1", 9999)))
1 caf.flow DEBUG actor6 140704119244544 caf.scheduled_actor enqueue scheduled_actor.cpp:162 ACCEPT ; UNBLOCKED = true
1 caf.flow DEBUG actor7 140704102459136 caf.scheduled_actor consume scheduled_actor.cpp:629 RECEIVE ; FROM = 6@924A36C480EC73E6E612AD663776410DC79CE407#12479 ; STAGES = [] ; CONTENT = (error(17,
 'system', ("ip_connect failed", "127.0.0.1", 9999)))
1 broker ERROR actor7 140704102459136 broker.detail.retry_state operator() core_actor.cc:82 remote endpoint unavailable
1 caf.flow DEBUG actor7 140704102459136 caf.scheduled_actor enqueue scheduled_actor.cpp:157 SEND ; TO = 10@924A36C480EC73E6E612AD663776410DC79CE407#12479 ; FROM = 7@924A36C480EC73E6E612AD6637764
10DC79CE407#12479 ; STAGES = [] ; CONTENT = ('local', error(4, 'broker', (invalid-node, *127.0.0.1:9999, "remote endpoint unavailable")))
1 caf.flow DEBUG actor7 140704102459136 caf.scheduled_actor enqueue scheduled_actor.cpp:162 ACCEPT ; UNBLOCKED = true
2 caf.flow DEBUG actor7 140704102459136 caf.scheduled_actor enqueue scheduled_actor.cpp:157 SEND ; TO = 8@924A36C480EC73E6E612AD663776410DC79CE407#12479 ; FROM = 7@924A36C480EC73E6E612AD66377641
0DC79CE407#12479 ; STAGES = [] ; CONTENT = ('local', error(4, 'broker', (invalid-node, *127.0.0.1:9999, "remote endpoint unavailable")))
2 caf.flow DEBUG actor7 140704102459136 caf.scheduled_actor enqueue scheduled_actor.cpp:162 ACCEPT ; UNBLOCKED = true
2 caf.flow DEBUG actor8 140704102459136 caf.scheduled_actor consume scheduled_actor.cpp:629 RECEIVE ; FROM = 7@924A36C480EC73E6E612AD663776410DC79CE407#12479 ; STAGES = [] ; CONTENT = ('local',
error(4, 'broker', (invalid-node, *127.0.0.1:9999, "remote endpoint unavailable")))
2 caf.flow DEBUG actor10 140704102459136 caf.scheduled_actor consume scheduled_actor.cpp:629 RECEIVE ; FROM = 7@924A36C480EC73E6E612AD663776410DC79CE407#12479 ; STAGES = [] ; CONTENT = ('local',
 error(4, 'broker', (invalid-node, *127.0.0.1:9999, "remote endpoint unavailable")))
1000 caf.flow DEBUG actor0 140704204359488 caf.scheduled_actor enqueue scheduled_actor.cpp:157 SEND ; TO = 10@924A36C480EC73E6E612AD663776410DC79CE407#12479 ; FROM = 0@invalid-node ; STAGES = []
 ; CONTENT = (exit_msg(10@924A36C480EC73E6E612AD663776410DC79CE407#12479, error(4, 'exit')))
1000 caf.flow DEBUG actor0 140704204359488 caf.scheduled_actor enqueue scheduled_actor.cpp:162 ACCEPT ; UNBLOCKED = true
1000 caf.flow DEBUG actor0 140704204359488 caf.scheduled_actor enqueue scheduled_actor.cpp:157 SEND ; TO = 7@924A36C480EC73E6E612AD663776410DC79CE407#12479 ; FROM = 0@invalid-node ; STAGES = []
; CONTENT = ('shutdown', 'store')
1000 caf.flow DEBUG actor0 140704204359488 caf.scheduled_actor enqueue scheduled_actor.cpp:162 ACCEPT ; UNBLOCKED = true
1000 caf.flow DEBUG actor11 140704204359488 caf.scheduled_actor enqueue scheduled_actor.cpp:157 SEND ; TO = 10@924A36C480EC73E6E612AD663776410DC79CE407#12479 ; FROM = 11@924A36C480EC73E6E612AD66
3776410DC79CE407#12479 ; STAGES = [] ; CONTENT = (exit_msg(11@924A36C480EC73E6E612AD663776410DC79CE407#12479, error(5, 'exit')))
1000 caf.flow DEBUG actor11 140704204359488 caf.scheduled_actor enqueue scheduled_actor.cpp:186 ACCEPT ; UNBLOCKED = false
1000 caf.flow DEBUG actor10 140704169600768 caf.scheduled_actor consume scheduled_actor.cpp:629 RECEIVE ; FROM = 0@invalid-node ; STAGES = [] ; CONTENT = (exit_msg(10@924A36C480EC73E6E612AD66377
6410DC79CE407#12479, error(4, 'exit')))
1000 caf.flow DEBUG actor10 140704169600768 caf.local_actor cleanup local_actor.cpp:124 TERMINATE ; ID = 10 ; REASON = error(4, 'exit') ; NODE = 924A36C480EC73E6E612AD663776410DC79CE407#12479
1000 caf.flow DEBUG actor10 140704169600768 caf.blocking_actor enqueue blocking_actor.cpp:67 SEND ; TO = 11@924A36C480EC73E6E612AD663776410DC79CE407#12479 ; FROM = 0@invalid-node ; STAGES = [] ;
 CONTENT = ('waitFor')
1000 caf.flow DEBUG actor10 140704169600768 caf.blocking_actor enqueue blocking_actor.cpp:78 ACCEPT ; UNBLOCKED = false
1000 caf.flow DEBUG actor7 140704169600768 caf.scheduled_actor consume scheduled_actor.cpp:629 RECEIVE ; FROM = 0@invalid-node ; STAGES = [] ; CONTENT = ('shutdown', 'store')
1001 caf.flow DEBUG actor11 140704204359488 caf.blocking_actor.mailbox_visitor operator() blocking_actor.cpp:157 RECEIVE ; FROM = 0@invalid-node ; STAGES = [] ; CONTENT = ('waitFor')
1001 caf.flow DEBUG actor11 140704204359488 caf.local_actor cleanup local_actor.cpp:124 TERMINATE ; ID = 11 ; REASON = none ; NODE = 924A36C480EC73E6E612AD663776410DC79CE407#12479
1001 caf.flow DEBUG actor0 140704204359488 caf.scheduled_actor enqueue scheduled_actor.cpp:157 SEND ; TO = 7@924A36C480EC73E6E612AD663776410DC79CE407#12479 ; FROM = 0@invalid-node ; STAGES = []
; CONTENT = ('shutdown')
1001 caf.flow DEBUG actor0 140704204359488 caf.scheduled_actor enqueue scheduled_actor.cpp:162 ACCEPT ; UNBLOCKED = true
1001 caf.flow DEBUG actor7 140704161208064 caf.scheduled_actor consume scheduled_actor.cpp:629 RECEIVE ; FROM = 0@invalid-node ; STAGES = [] ; CONTENT = ('shutdown')
1001 caf.flow DEBUG actor7 140704161208064 caf.local_actor cleanup local_actor.cpp:124 TERMINATE ; ID = 7 ; REASON = error(4, 'exit') ; NODE = 924A36C480EC73E6E612AD663776410DC79CE407#12479
1001 caf.flow DEBUG actor0 140704204359488 caf.scheduled_actor enqueue scheduled_actor.cpp:157 SEND ; TO = 1@924A36C480EC73E6E612AD663776410DC79CE407#12479 ; FROM = 0@invalid-node ; STAGES = []
; CONTENT = (exit_msg(1@924A36C480EC73E6E612AD663776410DC79CE407#12479, error(4, 'exit')))
1001 caf.flow DEBUG actor0 140704204359488 caf.scheduled_actor enqueue scheduled_actor.cpp:162 ACCEPT ; UNBLOCKED = true
1001 caf.flow DEBUG actor0 140704204359488 caf.scheduled_actor enqueue scheduled_actor.cpp:157 SEND ; TO = 2@924A36C480EC73E6E612AD663776410DC79CE407#12479 ; FROM = 0@invalid-node ; STAGES = []
; CONTENT = (exit_msg(2@924A36C480EC73E6E612AD663776410DC79CE407#12479, error(4, 'exit')))
1001 caf.flow DEBUG actor0 140704204359488 caf.scheduled_actor enqueue scheduled_actor.cpp:162 ACCEPT ; UNBLOCKED = true
1001 caf.flow DEBUG actor12 140704204359488 caf.scheduled_actor enqueue scheduled_actor.cpp:157 SEND ; TO = 8@924A36C480EC73E6E612AD663776410DC79CE407#12479 ; FROM = 12@924A36C480EC73E6E612AD663
776410DC79CE407#12479 ; STAGES = [] ; CONTENT = (exit_msg(12@924A36C480EC73E6E612AD663776410DC79CE407#12479, error(5, 'exit')))
1001 caf.flow DEBUG actor12 140704204359488 caf.scheduled_actor enqueue scheduled_actor.cpp:162 ACCEPT ; UNBLOCKED = true
1001 caf.flow DEBUG actor1 140704102459136 caf.scheduled_actor consume scheduled_actor.cpp:629 RECEIVE ; FROM = 0@invalid-node ; STAGES = [] ; CONTENT = (exit_msg(1@924A36C480EC73E6E612AD6637764
10DC79CE407#12479, error(4, 'exit')))
1001 caf.flow DEBUG actor1 140704102459136 caf.local_actor cleanup local_actor.cpp:124 TERMINATE ; ID = 1 ; REASON = error(4, 'exit') ; NODE = 924A36C480EC73E6E612AD663776410DC79CE407#12479
1001 caf.flow DEBUG actor8 140704102459136 caf.scheduled_actor consume scheduled_actor.cpp:629 RECEIVE ; FROM = 12@924A36C480EC73E6E612AD663776410DC79CE407#12479 ; STAGES = [] ; CONTENT = (exit_
msg(12@924A36C480EC73E6E612AD663776410DC79CE407#12479, error(5, 'exit')))
1001 caf.flow DEBUG actor8 140704102459136 caf.local_actor cleanup local_actor.cpp:124 TERMINATE ; ID = 8 ; REASON = error(5, 'exit') ; NODE = 924A36C480EC73E6E612AD663776410DC79CE407#12479
1001 caf.flow DEBUG actor8 140704102459136 caf.blocking_actor enqueue blocking_actor.cpp:67 SEND ; TO = 12@924A36C480EC73E6E612AD663776410DC79CE407#12479 ; FROM = 0@invalid-node ; STAGES = [] ;
CONTENT = ('waitFor')
1001 caf.flow DEBUG actor8 140704102459136 caf.blocking_actor enqueue blocking_actor.cpp:78 ACCEPT ; UNBLOCKED = false
1001 caf.flow DEBUG actor2 140704102459136 caf.scheduled_actor consume scheduled_actor.cpp:629 RECEIVE ; FROM = 0@invalid-node ; STAGES = [] ; CONTENT = (exit_msg(2@924A36C480EC73E6E612AD6637764
10DC79CE407#12479, error(4, 'exit')))
1001 caf.flow DEBUG actor2 140704102459136 caf.local_actor cleanup local_actor.cpp:124 TERMINATE ; ID = 2 ; REASON = error(4, 'exit') ; NODE = 924A36C480EC73E6E612AD663776410DC79CE407#12479
1001 caf.flow DEBUG actor12 140704204359488 caf.blocking_actor.mailbox_visitor operator() blocking_actor.cpp:157 RECEIVE ; FROM = 0@invalid-node ; STAGES = [] ; CONTENT = ('waitFor')
1001 caf.flow DEBUG actor12 140704204359488 caf.local_actor cleanup local_actor.cpp:124 TERMINATE ; ID = 12 ; REASON = none ; NODE = 924A36C480EC73E6E612AD663776410DC79CE407#12479
1001 caf.flow DEBUG actor13 140704204359488 caf.scheduled_actor enqueue scheduled_actor.cpp:157 SEND ; TO = 9@924A36C480EC73E6E612AD663776410DC79CE407#12479 ; FROM = 13@924A36C480EC73E6E612AD663
776410DC79CE407#12479 ; STAGES = [] ; CONTENT = (exit_msg(13@924A36C480EC73E6E612AD663776410DC79CE407#12479, error(5, 'exit')))
1001 caf.flow DEBUG actor13 140704204359488 caf.scheduled_actor enqueue scheduled_actor.cpp:162 ACCEPT ; UNBLOCKED = true
1001 caf.flow DEBUG actor9 140704161208064 caf.scheduled_actor consume scheduled_actor.cpp:629 RECEIVE ; FROM = 13@924A36C480EC73E6E612AD663776410DC79CE407#12479 ; STAGES = [] ; CONTENT = (exit_
msg(13@924A36C480EC73E6E612AD663776410DC79CE407#12479, error(5, 'exit')))
1001 caf.flow DEBUG actor9 140704161208064 caf.local_actor cleanup local_actor.cpp:124 TERMINATE ; ID = 9 ; REASON = error(5, 'exit') ; NODE = 924A36C480EC73E6E612AD663776410DC79CE407#12479
1001 caf.flow DEBUG actor9 140704161208064 caf.blocking_actor enqueue blocking_actor.cpp:67 SEND ; TO = 13@924A36C480EC73E6E612AD663776410DC79CE407#12479 ; FROM = 0@invalid-node ; STAGES = [] ;
CONTENT = ('waitFor')
1001 caf.flow DEBUG actor9 140704161208064 caf.blocking_actor enqueue blocking_actor.cpp:78 ACCEPT ; UNBLOCKED = false
1001 caf.flow DEBUG actor13 140704204359488 caf.blocking_actor.mailbox_visitor operator() blocking_actor.cpp:157 RECEIVE ; FROM = 0@invalid-node ; STAGES = [] ; CONTENT = ('waitFor')
1001 caf.flow DEBUG actor13 140704204359488 caf.local_actor cleanup local_actor.cpp:124 TERMINATE ; ID = 13 ; REASON = none ; NODE = 924A36C480EC73E6E612AD663776410DC79CE407#12479
1001 caf.flow DEBUG actor14 140704204359488 caf.scheduled_actor enqueue scheduled_actor.cpp:157 SEND ; TO = 6@924A36C480EC73E6E612AD663776410DC79CE407#12479 ; FROM = 14@924A36C480EC73E6E612AD663
776410DC79CE407#12479 ; STAGES = [] ; CONTENT = (exit_msg(14@924A36C480EC73E6E612AD663776410DC79CE407#12479, error(5, 'exit')))
1001 caf.flow DEBUG actor14 140704204359488 caf.scheduled_actor enqueue scheduled_actor.cpp:162 ACCEPT ; UNBLOCKED = true
1001 caf.flow DEBUG actor6 140704119244544 caf.scheduled_actor consume scheduled_actor.cpp:629 RECEIVE ; FROM = 14@924A36C480EC73E6E612AD663776410DC79CE407#12479 ; STAGES = [] ; CONTENT = (exit_
msg(14@924A36C480EC73E6E612AD663776410DC79CE407#12479, error(5, 'exit')))
1001 caf.flow DEBUG actor6 140704119244544 caf.local_actor cleanup local_actor.cpp:124 TERMINATE ; ID = 6 ; REASON = error(5, 'exit') ; NODE = 924A36C480EC73E6E612AD663776410DC79CE407#12479
1001 caf.flow DEBUG actor6 140704119244544 caf.blocking_actor enqueue blocking_actor.cpp:67 SEND ; TO = 14@924A36C480EC73E6E612AD663776410DC79CE407#12479 ; FROM = 0@invalid-node ; STAGES = [] ;
CONTENT = ('waitFor')
1001 caf.flow DEBUG actor6 140704119244544 caf.blocking_actor enqueue blocking_actor.cpp:78 ACCEPT ; UNBLOCKED = false
1001 caf.flow DEBUG actor14 140704204359488 caf.blocking_actor.mailbox_visitor operator() blocking_actor.cpp:157 RECEIVE ; FROM = 0@invalid-node ; STAGES = [] ; CONTENT = ('waitFor')
1001 caf.flow DEBUG actor14 140704204359488 caf.local_actor cleanup local_actor.cpp:124 TERMINATE ; ID = 14 ; REASON = none ; NODE = 924A36C480EC73E6E612AD663776410DC79CE407#12479
1001 caf.flow DEBUG actor0 140704136029952 caf.local_actor cleanup local_actor.cpp:124 TERMINATE ; ID = 4 ; REASON = none ; NODE = 924A36C480EC73E6E612AD663776410DC79CE407#12479
1002 caf.flow DEBUG actor15 140704204359488 caf.scheduled_actor enqueue scheduled_actor.cpp:157 SEND ; TO = 5@924A36C480EC73E6E612AD663776410DC79CE407#12479 ; FROM = 15@924A36C480EC73E6E612AD663
776410DC79CE407#12479 ; STAGES = [] ; CONTENT = (exit_msg(15@924A36C480EC73E6E612AD663776410DC79CE407#12479, error(5, 'exit')))
1002 caf.flow DEBUG actor15 140704204359488 caf.scheduled_actor enqueue scheduled_actor.cpp:162 ACCEPT ; UNBLOCKED = true
1002 caf.flow DEBUG actor5 140704127637248 caf.scheduled_actor consume scheduled_actor.cpp:629 RECEIVE ; FROM = 15@924A36C480EC73E6E612AD663776410DC79CE407#12479 ; STAGES = [] ; CONTENT = (exit_
msg(15@924A36C480EC73E6E612AD663776410DC79CE407#12479, error(5, 'exit')))
1002 caf.flow DEBUG actor5 140704127637248 caf.local_actor cleanup local_actor.cpp:124 TERMINATE ; ID = 5 ; REASON = error(5, 'exit') ; NODE = 924A36C480EC73E6E612AD663776410DC79CE407#12479
1002 caf.flow DEBUG actor5 140704127637248 caf.blocking_actor enqueue blocking_actor.cpp:67 SEND ; TO = 15@924A36C480EC73E6E612AD663776410DC79CE407#12479 ; FROM = 0@invalid-node ; STAGES = [] ;
CONTENT = ('waitFor')
1002 caf.flow DEBUG actor5 140704127637248 caf.blocking_actor enqueue blocking_actor.cpp:78 ACCEPT ; UNBLOCKED = false
1002 caf.flow DEBUG actor15 140704204359488 caf.blocking_actor.mailbox_visitor operator() blocking_actor.cpp:157 RECEIVE ; FROM = 0@invalid-node ; STAGES = [] ; CONTENT = ('waitFor')
1002 caf.flow DEBUG actor15 140704204359488 caf.local_actor cleanup local_actor.cpp:124 TERMINATE ; ID = 15 ; REASON = none ; NODE = 924A36C480EC73E6E612AD663776410DC79CE407#12479
1002 caf.flow DEBUG actor16 140704204359488 caf.blocking_actor enqueue blocking_actor.cpp:67 SEND ; TO = 3@924A36C480EC73E6E612AD663776410DC79CE407#12479 ; FROM = 0@invalid-node ; STAGES = [] ;
CONTENT = (exit_msg(3@924A36C480EC73E6E612AD663776410DC79CE407#12479, error(4, 'exit')))
1002 caf.flow DEBUG actor16 140704204359488 caf.blocking_actor enqueue blocking_actor.cpp:78 ACCEPT ; UNBLOCKED = false
1002 caf.flow DEBUG actor3 140704144422656 caf.blocking_actor.mailbox_visitor operator() blocking_actor.cpp:157 RECEIVE ; FROM = 0@invalid-node ; STAGES = [] ; CONTENT = (exit_msg(3@924A36C480EC
73E6E612AD663776410DC79CE407#12479, error(4, 'exit')))
1002 caf.flow DEBUG actor3 140704144422656 caf.local_actor cleanup local_actor.cpp:124 TERMINATE ; ID = 3 ; REASON = error(4, 'exit') ; NODE = 924A36C480EC73E6E612AD663776410DC79CE407#12479
1002 caf.flow DEBUG actor3 140704144422656 caf.blocking_actor enqueue blocking_actor.cpp:67 SEND ; TO = 16@924A36C480EC73E6E612AD663776410DC79CE407#12479 ; FROM = 0@invalid-node ; STAGES = [] ;
CONTENT = ('waitFor')
1002 caf.flow DEBUG actor3 140704144422656 caf.blocking_actor enqueue blocking_actor.cpp:78 ACCEPT ; UNBLOCKED = false
1002 caf.flow DEBUG actor16 140704204359488 caf.blocking_actor.mailbox_visitor operator() blocking_actor.cpp:157 RECEIVE ; FROM = 0@invalid-node ; STAGES = [] ; CONTENT = ('waitFor')
1002 caf.flow DEBUG actor16 140704204359488 caf.local_actor cleanup local_actor.cpp:124 TERMINATE ; ID = 16 ; REASON = none ; NODE = 924A36C480EC73E6E612AD663776410DC79CE407#12479
1003 caf DEBUG actor0 140704110851840 caf.logger log_last_line logger.cpp:632
```
thank oyu!
scott

**Comment by set-element** [comment]
The broker debug logs from the zeek instance at the same time looked like:

```
[root@centos-s-1vcpu-2gb-nyc1-01 tmp]# cat debug.log
         0.000000/1578687517.061571 [broker] Initializing
1578687517.102547/1578687517.135346 [broker] Subscribing to topic prefix /zeek/zeek-agent/zeek/BroMaster
1578687517.102547/1578687517.139390 [broker] Listening on 127.0.0.1:9998
1578687517.102547/1578687517.139459 [broker] Subscribing to topic prefix /zeek/zeek-agent/host_announce
1578687517.102547/1578687517.140596 [broker] Subscribing to topic prefix /zeek/zeek-agent/zeek_announce
1578687517.102547/1578687517.141193 [broker] Subscribing to topic prefix /zeek/zeek-agent/zeek/924A36C480EC73E6E612AD663776410DC79CE400#12468
1578687517.102547/1578687517.142264 [broker] Subscribing to topic prefix /zeek/zeek-agent/zeek/BroMaster
1578695636.784916/1578695636.793325 [broker] Flushing all log buffers
1578695636.784916/1578695636.793383 [broker] Flushing all log buffers
[root@centos-s-1vcpu-2gb-nyc1-01 tmp]#
```
thanks,
scott

**Comment by rsmmr** [comment]
The debug log seems to say that it can't set up the TCP connection ("ip_connect failed", "remote endpoint unavailable"). On the other hand, the tcpdump output shows that there *is* a connection being established. @Neverlord Do you have an idea what's going on here?

**Comment by set-element** [comment]
Looking at the debug info, it seems I may have sent the wrong set of logs. Problem still exhibits itself, but that was from one of a set of sanity checks I was doing. Attaching known correct logs now.

```
[root@centos-s-1vcpu-2gb-nyc1-01 build_no_osq]# more broker_16052_1578764003945236000.log
2 caf DEBUG actor0 140467332114176 caf.logger log_first_line logger.cpp:614 level = trace, node = 924A36C480EC73E6E612AD663776410DC79CE400#16052, component_filter = ""
0 caf.flow DEBUG actor0 140467434014528 caf.scheduled_actor enqueue scheduled_actor.cpp:157 SEND ; TO = 7@924A36C480EC73E6E612AD663776410DC79CE400#16052 ; FROM = 0@invalid-node ; STAGES = [] ; C
ONTENT = ('add', 'status', 10@924A36C480EC73E6E612AD663776410DC79CE400#16052)
0 caf.flow DEBUG actor0 140467434014528 caf.scheduled_actor enqueue scheduled_actor.cpp:186 ACCEPT ; UNBLOCKED = false
0 caf.flow DEBUG actor0 140467434014528 caf.scheduled_actor enqueue scheduled_actor.cpp:157 SEND ; TO = 7@924A36C480EC73E6E612AD663776410DC79CE400#16052 ; FROM = 0@invalid-node ; STAGES = [] ; C
ONTENT = ('peer', 127.0.0.1:9999)
0 caf.flow DEBUG actor0 140467434014528 caf.scheduled_actor enqueue scheduled_actor.cpp:186 ACCEPT ; UNBLOCKED = false
0 caf.flow DEBUG actor7 140467399255808 caf.scheduled_actor consume scheduled_actor.cpp:629 RECEIVE ; FROM = 0@invalid-node ; STAGES = [] ; CONTENT = ('add', 'status', 10@924A36C480EC73E6E612AD6
63776410DC79CE400#16052)
1 caf.flow DEBUG actor7 140467399255808 caf.scheduled_actor consume scheduled_actor.cpp:629 RECEIVE ; FROM = 0@invalid-node ; STAGES = [] ; CONTENT = ('peer', 127.0.0.1:9999)
1 caf.flow DEBUG actor7 140467399255808 caf.scheduled_actor enqueue scheduled_actor.cpp:157 SEND ; TO = 6@924A36C480EC73E6E612AD663776410DC79CE400#16052 ; FROM = 7@924A36C480EC73E6E612AD66377641
0DC79CE400#16052 ; STAGES = [] ; CONTENT = ('connect', "127.0.0.1", 9999)
1 caf.flow DEBUG actor7 140467399255808 caf.scheduled_actor enqueue scheduled_actor.cpp:186 ACCEPT ; UNBLOCKED = false
3 caf.flow DEBUG actor6 140467340506880 caf.scheduled_actor consume scheduled_actor.cpp:629 RECEIVE ; FROM = 7@924A36C480EC73E6E612AD663776410DC79CE400#16052 ; STAGES = [] ; CONTENT = ('connect'
, "127.0.0.1", 9999)
18 caf.flow DEBUG actor4 140467340506880 caf.scheduled_actor enqueue scheduled_actor.cpp:157 SEND ; TO = 4@924A36C480EC73E6E612AD663776410DC79CE400#16052 ; FROM = 6@924A36C480EC73E6E612AD6637764
10DC79CE400#16052 ; STAGES = [] ; CONTENT = ('connect', 506B0100C17F0000, 9999)
18 caf.flow DEBUG actor4 140467340506880 caf.scheduled_actor enqueue scheduled_actor.cpp:162 ACCEPT ; UNBLOCKED = true
19 caf.flow DEBUG actor4 140467357292288 caf.scheduled_actor consume scheduled_actor.cpp:629 RECEIVE ; FROM = 6@924A36C480EC73E6E612AD663776410DC79CE400#16052 ; STAGES = [] ; CONTENT = ('connect
', 506B0100C17F0000, 9999)
42 caf.flow DEBUG actor0 140467357292288 caf.scheduled_actor consume scheduled_actor.cpp:629 RECEIVE ; FROM = 0@invalid-node ; STAGES = [] ; CONTENT = (new_data_msg(11, 0000000000000034000000000
00000030000000000000000000000000000000000003E9AAB9BAC7900003EAB924A36C480EC73E6E612AD663776410DC79CE400010962726F6B65722E763200000000000000))
42 caf.flow DEBUG actor0 140467357292288 caf.scheduled_actor enqueue scheduled_actor.cpp:157 SEND ; TO = 6@924A36C480EC73E6E612AD663776410DC79CE400#16052 ; FROM = 4@924A36C480EC73E6E612AD6637764
10DC79CE400#16052 ; STAGES = [] ; CONTENT = (error(11, 'system'))
42 caf.flow DEBUG actor0 140467357292288 caf.scheduled_actor enqueue scheduled_actor.cpp:162 ACCEPT ; UNBLOCKED = true
42 caf.flow DEBUG actor6 140467340506880 caf.scheduled_actor consume scheduled_actor.cpp:629 RECEIVE ; FROM = 4@924A36C480EC73E6E612AD663776410DC79CE400#16052 ; STAGES = [] ; CONTENT = (error(11
, 'system'))
42 caf.flow DEBUG actor6 140467340506880 caf.scheduled_actor enqueue scheduled_actor.cpp:157 SEND ; TO = 7@924A36C480EC73E6E612AD663776410DC79CE400#16052 ; FROM = 6@924A36C480EC73E6E612AD6637764
10DC79CE400#16052 ; STAGES = [] ; CONTENT = (error(11, 'system'))
42 caf.flow DEBUG actor6 140467340506880 caf.scheduled_actor enqueue scheduled_actor.cpp:162 ACCEPT ; UNBLOCKED = true
42 caf.flow DEBUG actor7 140467382470400 caf.scheduled_actor consume scheduled_actor.cpp:629 RECEIVE ; FROM = 6@924A36C480EC73E6E612AD663776410DC79CE400#16052 ; STAGES = [] ; CONTENT = (error(11
, 'system'))
42 broker ERROR actor7 140467382470400 broker.detail.retry_state operator() core_actor.cc:82 remote endpoint unavailable
43 caf.flow DEBUG actor7 140467382470400 caf.scheduled_actor enqueue scheduled_actor.cpp:157 SEND ; TO = 10@924A36C480EC73E6E612AD663776410DC79CE400#16052 ; FROM = 7@924A36C480EC73E6E612AD663776
410DC79CE400#16052 ; STAGES = [] ; CONTENT = ('local', error(4, 'broker', (invalid-node, *127.0.0.1:9999, "remote endpoint unavailable")))
43 caf.flow DEBUG actor7 140467382470400 caf.scheduled_actor enqueue scheduled_actor.cpp:162 ACCEPT ; UNBLOCKED = true
43 caf.flow DEBUG actor7 140467382470400 caf.scheduled_actor enqueue scheduled_actor.cpp:157 SEND ; TO = 8@924A36C480EC73E6E612AD663776410DC79CE400#16052 ; FROM = 7@924A36C480EC73E6E612AD6637764
10DC79CE400#16052 ; STAGES = [] ; CONTENT = ('local', error(4, 'broker', (invalid-node, *127.0.0.1:9999, "remote endpoint unavailable")))
43 caf.flow DEBUG actor7 140467382470400 caf.scheduled_actor enqueue scheduled_actor.cpp:162 ACCEPT ; UNBLOCKED = true
43 caf.flow DEBUG actor8 140467382470400 caf.scheduled_actor consume scheduled_actor.cpp:629 RECEIVE ; FROM = 7@924A36C480EC73E6E612AD663776410DC79CE400#16052 ; STAGES = [] ; CONTENT = ('local',
 error(4, 'broker', (invalid-node, *127.0.0.1:9999, "remote endpoint unavailable")))
43 caf.flow DEBUG actor10 140467382470400 caf.scheduled_actor consume scheduled_actor.cpp:629 RECEIVE ; FROM = 7@924A36C480EC73E6E612AD663776410DC79CE400#16052 ; STAGES = [] ; CONTENT = ('local'
, error(4, 'broker', (invalid-node, *127.0.0.1:9999, "remote endpoint unavailable")))
1000 caf.flow DEBUG actor0 140467434014528 caf.scheduled_actor enqueue scheduled_actor.cpp:157 SEND ; TO = 10@924A36C480EC73E6E612AD663776410DC79CE400#16052 ; FROM = 0@invalid-node ; STAGES = []
 ; CONTENT = (exit_msg(10@924A36C480EC73E6E612AD663776410DC79CE400#16052, error(4, 'exit')))
1000 caf.flow DEBUG actor0 140467434014528 caf.scheduled_actor enqueue scheduled_actor.cpp:162 ACCEPT ; UNBLOCKED = true
1000 caf.flow DEBUG actor0 140467434014528 caf.scheduled_actor enqueue scheduled_actor.cpp:157 SEND ; TO = 7@924A36C480EC73E6E612AD663776410DC79CE400#16052 ; FROM = 0@invalid-node ; STAGES = []
; CONTENT = ('shutdown', 'store')
1000 caf.flow DEBUG actor0 140467434014528 caf.scheduled_actor enqueue scheduled_actor.cpp:162 ACCEPT ; UNBLOCKED = true
1000 caf.flow DEBUG actor11 140467434014528 caf.scheduled_actor enqueue scheduled_actor.cpp:157 SEND ; TO = 10@924A36C480EC73E6E612AD663776410DC79CE400#16052 ; FROM = 11@924A36C480EC73E6E612AD66
3776410DC79CE400#16052 ; STAGES = [] ; CONTENT = (exit_msg(11@924A36C480EC73E6E612AD663776410DC79CE400#16052, error(5, 'exit')))
1000 caf.flow DEBUG actor11 140467434014528 caf.scheduled_actor enqueue scheduled_actor.cpp:186 ACCEPT ; UNBLOCKED = false
1001 caf.flow DEBUG actor10 140467399255808 caf.scheduled_actor consume scheduled_actor.cpp:629 RECEIVE ; FROM = 0@invalid-node ; STAGES = [] ; CONTENT = (exit_msg(10@924A36C480EC73E6E612AD66377
6410DC79CE400#16052, error(4, 'exit')))
1001 caf.flow DEBUG actor10 140467399255808 caf.local_actor cleanup local_actor.cpp:124 TERMINATE ; ID = 10 ; REASON = error(4, 'exit') ; NODE = 924A36C480EC73E6E612AD663776410DC79CE400#16052
1001 caf.flow DEBUG actor10 140467399255808 caf.blocking_actor enqueue blocking_actor.cpp:67 SEND ; TO = 11@924A36C480EC73E6E612AD663776410DC79CE400#16052 ; FROM = 0@invalid-node ; STAGES = [] ;
 CONTENT = ('waitFor')
1001 caf.flow DEBUG actor10 140467399255808 caf.blocking_actor enqueue blocking_actor.cpp:78 ACCEPT ; UNBLOCKED = false
1001 caf.flow DEBUG actor7 140467399255808 caf.scheduled_actor consume scheduled_actor.cpp:629 RECEIVE ; FROM = 0@invalid-node ; STAGES = [] ; CONTENT = ('shutdown', 'store')
1001 caf.flow DEBUG actor11 140467434014528 caf.blocking_actor.mailbox_visitor operator() blocking_actor.cpp:157 RECEIVE ; FROM = 0@invalid-node ; STAGES = [] ; CONTENT = ('waitFor')
1001 caf.flow DEBUG actor11 140467434014528 caf.local_actor cleanup local_actor.cpp:124 TERMINATE ; ID = 11 ; REASON = none ; NODE = 924A36C480EC73E6E612AD663776410DC79CE400#16052
1001 caf.flow DEBUG actor0 140467434014528 caf.scheduled_actor enqueue scheduled_actor.cpp:157 SEND ; TO = 7@924A36C480EC73E6E612AD663776410DC79CE400#16052 ; FROM = 0@invalid-node ; STAGES = []
; CONTENT = ('shutdown')
1001 caf.flow DEBUG actor0 140467434014528 caf.scheduled_actor enqueue scheduled_actor.cpp:162 ACCEPT ; UNBLOCKED = true
1001 caf.flow DEBUG actor7 140467382470400 caf.scheduled_actor consume scheduled_actor.cpp:629 RECEIVE ; FROM = 0@invalid-node ; STAGES = [] ; CONTENT = ('shutdown')
1001 caf.flow DEBUG actor7 140467382470400 caf.local_actor cleanup local_actor.cpp:124 TERMINATE ; ID = 7 ; REASON = error(4, 'exit') ; NODE = 924A36C480EC73E6E612AD663776410DC79CE400#16052
1001 caf.flow DEBUG actor0 140467434014528 caf.scheduled_actor enqueue scheduled_actor.cpp:157 SEND ; TO = 1@924A36C480EC73E6E612AD663776410DC79CE400#16052 ; FROM = 0@invalid-node ; STAGES = []
; CONTENT = (exit_msg(1@924A36C480EC73E6E612AD663776410DC79CE400#16052, error(4, 'exit')))
1001 caf.flow DEBUG actor0 140467434014528 caf.scheduled_actor enqueue scheduled_actor.cpp:162 ACCEPT ; UNBLOCKED = true
1001 caf.flow DEBUG actor0 140467434014528 caf.scheduled_actor enqueue scheduled_actor.cpp:157 SEND ; TO = 2@924A36C480EC73E6E612AD663776410DC79CE400#16052 ; FROM = 0@invalid-node ; STAGES = []
; CONTENT = (exit_msg(2@924A36C480EC73E6E612AD663776410DC79CE400#16052, error(4, 'exit')))
1001 caf.flow DEBUG actor0 140467434014528 caf.scheduled_actor enqueue scheduled_actor.cpp:162 ACCEPT ; UNBLOCKED = true
1001 caf.flow DEBUG actor12 140467434014528 caf.scheduled_actor enqueue scheduled_actor.cpp:157 SEND ; TO = 8@924A36C480EC73E6E612AD663776410DC79CE400#16052 ; FROM = 12@924A36C480EC73E6E612AD663
776410DC79CE400#16052 ; STAGES = [] ; CONTENT = (exit_msg(12@924A36C480EC73E6E612AD663776410DC79CE400#16052, error(5, 'exit')))
1001 caf.flow DEBUG actor12 140467434014528 caf.scheduled_actor enqueue scheduled_actor.cpp:162 ACCEPT ; UNBLOCKED = true
1001 caf.flow DEBUG actor1 140467407648512 caf.scheduled_actor consume scheduled_actor.cpp:629 RECEIVE ; FROM = 0@invalid-node ; STAGES = [] ; CONTENT = (exit_msg(1@924A36C480EC73E6E612AD6637764
10DC79CE400#16052, error(4, 'exit')))
1001 caf.flow DEBUG actor1 140467407648512 caf.local_actor cleanup local_actor.cpp:124 TERMINATE ; ID = 1 ; REASON = error(4, 'exit') ; NODE = 924A36C480EC73E6E612AD663776410DC79CE400#16052
1001 caf.flow DEBUG actor8 140467407648512 caf.scheduled_actor consume scheduled_actor.cpp:629 RECEIVE ; FROM = 12@924A36C480EC73E6E612AD663776410DC79CE400#16052 ; STAGES = [] ; CONTENT = (exit_
msg(12@924A36C480EC73E6E612AD663776410DC79CE400#16052, error(5, 'exit')))
1001 caf.flow DEBUG actor8 140467407648512 caf.local_actor cleanup local_actor.cpp:124 TERMINATE ; ID = 8 ; REASON = error(5, 'exit') ; NODE = 924A36C480EC73E6E612AD663776410DC79CE400#16052
1001 caf.flow DEBUG actor8 140467407648512 caf.blocking_actor enqueue blocking_actor.cpp:67 SEND ; TO = 12@924A36C480EC73E6E612AD663776410DC79CE400#16052 ; FROM = 0@invalid-node ; STAGES = [] ;
CONTENT = ('waitFor')
1001 caf.flow DEBUG actor8 140467407648512 caf.blocking_actor enqueue blocking_actor.cpp:78 ACCEPT ; UNBLOCKED = false
1001 caf.flow DEBUG actor2 140467407648512 caf.scheduled_actor consume scheduled_actor.cpp:629 RECEIVE ; FROM = 0@invalid-node ; STAGES = [] ; CONTENT = (exit_msg(2@924A36C480EC73E6E612AD6637764
10DC79CE400#16052, error(4, 'exit')))
1001 caf.flow DEBUG actor2 140467407648512 caf.local_actor cleanup local_actor.cpp:124 TERMINATE ; ID = 2 ; REASON = error(4, 'exit') ; NODE = 924A36C480EC73E6E612AD663776410DC79CE400#16052
1002 caf.flow DEBUG actor12 140467434014528 caf.blocking_actor.mailbox_visitor operator() blocking_actor.cpp:157 RECEIVE ; FROM = 0@invalid-node ; STAGES = [] ; CONTENT = ('waitFor')
1002 caf.flow DEBUG actor12 140467434014528 caf.local_actor cleanup local_actor.cpp:124 TERMINATE ; ID = 12 ; REASON = none ; NODE = 924A36C480EC73E6E612AD663776410DC79CE400#16052
1002 caf.flow DEBUG actor13 140467434014528 caf.scheduled_actor enqueue scheduled_actor.cpp:157 SEND ; TO = 9@924A36C480EC73E6E612AD663776410DC79CE400#16052 ; FROM = 13@924A36C480EC73E6E612AD663
776410DC79CE400#16052 ; STAGES = [] ; CONTENT = (exit_msg(13@924A36C480EC73E6E612AD663776410DC79CE400#16052, error(5, 'exit')))
1002 caf.flow DEBUG actor13 140467434014528 caf.scheduled_actor enqueue scheduled_actor.cpp:162 ACCEPT ; UNBLOCKED = true
1002 caf.flow DEBUG actor9 140467382470400 caf.scheduled_actor consume scheduled_actor.cpp:629 RECEIVE ; FROM = 13@924A36C480EC73E6E612AD663776410DC79CE400#16052 ; STAGES = [] ; CONTENT = (exit_
msg(13@924A36C480EC73E6E612AD663776410DC79CE400#16052, error(5, 'exit')))
1002 caf.flow DEBUG actor9 140467382470400 caf.local_actor cleanup local_actor.cpp:124 TERMINATE ; ID = 9 ; REASON = error(5, 'exit') ; NODE = 924A36C480EC73E6E612AD663776410DC79CE400#16052
1002 caf.flow DEBUG actor9 140467382470400 caf.blocking_actor enqueue blocking_actor.cpp:67 SEND ; TO = 13@924A36C480EC73E6E612AD663776410DC79CE400#16052 ; FROM = 0@invalid-node ; STAGES = [] ;
CONTENT = ('waitFor')
1002 caf.flow DEBUG actor9 140467382470400 caf.blocking_actor enqueue blocking_actor.cpp:78 ACCEPT ; UNBLOCKED = false
1002 caf.flow DEBUG actor13 140467434014528 caf.blocking_actor.mailbox_visitor operator() blocking_actor.cpp:157 RECEIVE ; FROM = 0@invalid-node ; STAGES = [] ; CONTENT = ('waitFor')
1002 caf.flow DEBUG actor13 140467434014528 caf.local_actor cleanup local_actor.cpp:124 TERMINATE ; ID = 13 ; REASON = none ; NODE = 924A36C480EC73E6E612AD663776410DC79CE400#16052
1002 caf.flow DEBUG actor14 140467434014528 caf.scheduled_actor enqueue scheduled_actor.cpp:157 SEND ; TO = 6@924A36C480EC73E6E612AD663776410DC79CE400#16052 ; FROM = 14@924A36C480EC73E6E612AD663
776410DC79CE400#16052 ; STAGES = [] ; CONTENT = (exit_msg(14@924A36C480EC73E6E612AD663776410DC79CE400#16052, error(5, 'exit')))
1002 caf.flow DEBUG actor14 140467434014528 caf.scheduled_actor enqueue scheduled_actor.cpp:162 ACCEPT ; UNBLOCKED = true
1002 caf.flow DEBUG actor6 140467340506880 caf.scheduled_actor consume scheduled_actor.cpp:629 RECEIVE ; FROM = 14@924A36C480EC73E6E612AD663776410DC79CE400#16052 ; STAGES = [] ; CONTENT = (exit_
msg(14@924A36C480EC73E6E612AD663776410DC79CE400#16052, error(5, 'exit')))
1002 caf.flow DEBUG actor6 140467340506880 caf.local_actor cleanup local_actor.cpp:124 TERMINATE ; ID = 6 ; REASON = error(5, 'exit') ; NODE = 924A36C480EC73E6E612AD663776410DC79CE400#16052
1002 caf.flow DEBUG actor6 140467340506880 caf.blocking_actor enqueue blocking_actor.cpp:67 SEND ; TO = 14@924A36C480EC73E6E612AD663776410DC79CE400#16052 ; FROM = 0@invalid-node ; STAGES = [] ;
CONTENT = ('waitFor')
1002 caf.flow DEBUG actor6 140467340506880 caf.blocking_actor enqueue blocking_actor.cpp:78 ACCEPT ; UNBLOCKED = false
1002 caf.flow DEBUG actor14 140467434014528 caf.blocking_actor.mailbox_visitor operator() blocking_actor.cpp:157 RECEIVE ; FROM = 0@invalid-node ; STAGES = [] ; CONTENT = ('waitFor')
1002 caf.flow DEBUG actor14 140467434014528 caf.local_actor cleanup local_actor.cpp:124 TERMINATE ; ID = 14 ; REASON = none ; NODE = 924A36C480EC73E6E612AD663776410DC79CE400#16052
1002 caf.flow DEBUG actor0 140467357292288 caf.local_actor cleanup local_actor.cpp:124 TERMINATE ; ID = 4 ; REASON = none ; NODE = 924A36C480EC73E6E612AD663776410DC79CE400#16052
1003 caf.flow DEBUG actor15 140467434014528 caf.scheduled_actor enqueue scheduled_actor.cpp:157 SEND ; TO = 5@924A36C480EC73E6E612AD663776410DC79CE400#16052 ; FROM = 15@924A36C480EC73E6E612AD663
776410DC79CE400#16052 ; STAGES = [] ; CONTENT = (exit_msg(15@924A36C480EC73E6E612AD663776410DC79CE400#16052, error(5, 'exit')))
1003 caf.flow DEBUG actor15 140467434014528 caf.scheduled_actor enqueue scheduled_actor.cpp:162 ACCEPT ; UNBLOCKED = true
1003 caf.flow DEBUG actor5 140467348899584 caf.scheduled_actor consume scheduled_actor.cpp:629 RECEIVE ; FROM = 15@924A36C480EC73E6E612AD663776410DC79CE400#16052 ; STAGES = [] ; CONTENT = (exit_
msg(15@924A36C480EC73E6E612AD663776410DC79CE400#16052, error(5, 'exit')))
1003 caf.flow DEBUG actor5 140467348899584 caf.local_actor cleanup local_actor.cpp:124 TERMINATE ; ID = 5 ; REASON = error(5, 'exit') ; NODE = 924A36C480EC73E6E612AD663776410DC79CE400#16052
1003 caf.flow DEBUG actor5 140467348899584 caf.blocking_actor enqueue blocking_actor.cpp:67 SEND ; TO = 15@924A36C480EC73E6E612AD663776410DC79CE400#16052 ; FROM = 0@invalid-node ; STAGES = [] ;
CONTENT = ('waitFor')
1003 caf.flow DEBUG actor5 140467348899584 caf.blocking_actor enqueue blocking_actor.cpp:78 ACCEPT ; UNBLOCKED = false
1003 caf.flow DEBUG actor15 140467434014528 caf.blocking_actor.mailbox_visitor operator() blocking_actor.cpp:157 RECEIVE ; FROM = 0@invalid-node ; STAGES = [] ; CONTENT = ('waitFor')
1003 caf.flow DEBUG actor15 140467434014528 caf.local_actor cleanup local_actor.cpp:124 TERMINATE ; ID = 15 ; REASON = none ; NODE = 924A36C480EC73E6E612AD663776410DC79CE400#16052
1003 caf.flow DEBUG actor16 140467434014528 caf.blocking_actor enqueue blocking_actor.cpp:67 SEND ; TO = 3@924A36C480EC73E6E612AD663776410DC79CE400#16052 ; FROM = 0@invalid-node ; STAGES = [] ;
CONTENT = (exit_msg(3@924A36C480EC73E6E612AD663776410DC79CE400#16052, error(4, 'exit')))
1003 caf.flow DEBUG actor16 140467434014528 caf.blocking_actor enqueue blocking_actor.cpp:78 ACCEPT ; UNBLOCKED = false
1004 caf.flow DEBUG actor3 140467365684992 caf.blocking_actor.mailbox_visitor operator() blocking_actor.cpp:157 RECEIVE ; FROM = 0@invalid-node ; STAGES = [] ; CONTENT = (exit_msg(3@924A36C480EC
73E6E612AD663776410DC79CE400#16052, error(4, 'exit')))
1004 caf.flow DEBUG actor3 140467365684992 caf.local_actor cleanup local_actor.cpp:124 TERMINATE ; ID = 3 ; REASON = error(4, 'exit') ; NODE = 924A36C480EC73E6E612AD663776410DC79CE400#16052
1004 caf.flow DEBUG actor3 140467365684992 caf.blocking_actor enqueue blocking_actor.cpp:67 SEND ; TO = 16@924A36C480EC73E6E612AD663776410DC79CE400#16052 ; FROM = 0@invalid-node ; STAGES = [] ;
CONTENT = ('waitFor')
1004 caf.flow DEBUG actor3 140467365684992 caf.blocking_actor enqueue blocking_actor.cpp:78 ACCEPT ; UNBLOCKED = false
1004 caf.flow DEBUG actor16 140467434014528 caf.blocking_actor.mailbox_visitor operator() blocking_actor.cpp:157 RECEIVE ; FROM = 0@invalid-node ; STAGES = [] ; CONTENT = ('waitFor')
1004 caf.flow DEBUG actor16 140467434014528 caf.local_actor cleanup local_actor.cpp:124 TERMINATE ; ID = 16 ; REASON = none ; NODE = 924A36C480EC73E6E612AD663776410DC79CE400#16052
1004 caf DEBUG actor0 140467332114176 caf.logger log_last_line logger.cpp:632
[root@centos-s-1vcpu-2gb-nyc1-01 build_no_osq]#
```

Debug logs:

```
         0.000000/1578764002.968318 [broker] Initializing
1578764003.014864/1578764003.051181 [broker] Subscribing to topic prefix /zeek/zeek-agent/zeek/BroMaster
1578764003.014864/1578764003.055436 [broker] Listening on 127.0.0.1:9999
1578764003.014864/1578764003.055541 [broker] Subscribing to topic prefix /zeek/zeek-agent/host_announce
1578764003.014864/1578764003.056871 [broker] Subscribing to topic prefix /zeek/zeek-agent/zeek_announce
1578764003.014864/1578764003.057589 [broker] Subscribing to topic prefix /zeek/zeek-agent/zeek/924A36C480EC73E6E612AD663776410DC79CE400#16043
1578764003.014864/1578764003.058673 [broker] Subscribing to topic prefix /zeek/zeek-agent/zeek/BroMaster
1578764003.014864/1578764003.059181 [broker] Subscribing to topic prefix /zeek/zeek-agent/zeek/BroMaster
1578764003.014864/1578764003.059659 [broker] Subscribing to topic prefix /zeek/zeek-agent/zeek/BroMaster
1578764085.273334/1578764085.278986 [broker] Flushing all log buffers
1578764085.273334/1578764085.279030 [broker] Flushing all log buffers
```

My apologies for the confusion(!)
scott

**Comment by Neverlord** [comment]
There's not much I can add here, I'm afraid. From the debug output, it seems like the nodes first establish a connection but then one end closes the connection right away. `CONTENT = (error(11
, 'system'))` is [`disconnect_during_handshake`](https://github.com/actor-framework/actor-framework/blob/master/libcaf_core/caf/sec.hpp#L58).

If all else fails, you could recompile and run Broker/CAF with log level `TRACE` and also use the setting `logger.component-blacklist=[]` to get a more detailed look. Trace logs quickly become huge, but sometimes they're the best way to get to the bottom of things.

**Comment by set-element** [comment]
Thank you - I will give it a try and respond with the results.  Off hand, has this set of software been tested against a redhat/centos/scientific flavor linux? 

cheers,
scott

**Comment by rsmmr** [comment]
Ok, I believe it's a change between Zeek 3.0 and current git. I just tried master and it's not working for me either.  

Can you try a stock 3.0 and see if that makes a difference? 

And yes, I'm testing on Amazon Linux, which is a RH flavor.

**Comment by set-element** [comment]
Works perfectly - I really appreciate the time and work on this! Will close ticket as the immediate issue with me is resolved.
cheers,
scott

**Comment by Neverlord** [comment]
To summarize what's going on: Zeek 3.0 uses a CAF 0.16 release. Zeek `master` (what's going to be 3.1) is using CAF 0.17. The two CAF versions are incompatible. The CAF handshake detects a version mismatch and then closes the connection right away. This is why TCP connects but then comes a disconnect immediately.

Broker should, of course, report this error in a user-friendly and comprehensible manner.
